mysql> select * from course;
+----------+-------------+-------------+--------+
| faculty  | subjectcode | subjectname | nostds |
+----------+-------------+-------------+--------+
| deepamam |         516 | dbms        |     38 |
+----------+-------------+-------------+--------+
1 row in set (0.00 sec)

mysql>  update course set subjectcode=1516 where subjectname=dbms;
ERROR 1054 (42S22): Unknown column 'dbms' in 'where clause'
mysql>   update course set subjectcode=1516 where subjectname='dbms';
Query OK, 1 row affected (0.02 sec)
Rows matched: 1  Changed: 1  Warnings: 0

mysql> select * from course;
+----------+-------------+-------------+--------+
| faculty  | subjectcode | subjectname | nostds |
+----------+-------------+-------------+--------+
| deepamam |        1516 | dbms        |     38 |
+----------+-------------+-------------+--------+
1 row in set (0.00 sec)

mysql> delete * from course;
ERROR 1064 (42000): You have an error in your SQL syntax; check the manual that corresponds to your MySQL server version for the right syntax to use near '* from course' at line 1
mysql> delete from course where nostds;
Query OK, 1 row affected (0.01 sec)

mysql> select * from course;
Empty set (0.00 sec)